{
  "schema_version": 1,
  "subject": "g9_m95_single_source_truth",
  "symbolic_gate_key": "g9.p0.m95.single_source_truth",
  "matrix_row": "M95",
  "milestone": "M95",
  "assertion_id": "g9.p0.m95.single_source_truth",
  "status": "pass",
  "wave": "G9.3",
  "numeric_step": 141,
  "source_ref": "RFC-0022 §4.4;spec/virtual_geometry.md RXS-0352;G9_ACCEPTANCE_MAP §2 M95",
  "base_commit": "02472bcf946b81e239b40df0d817c58687c79418",
  "host_section_pass": true,
  "device_section_state": "executed",
  "checks": {
    "host_provenance_tests_anchored": true,
    "host_consumer_anchor_tests_anchored": true,
    "conformance_red_corpus_anchored": true,
    "probe_m95_checks_green": true,
    "device_sw_hw_diff_zero": true,
    "device_provenance_consumption_anchors": true,
    "device_red_arms_ok": true,
    "device_validation_zero": true
  },
  "commands": [
    {
      "seq": 1,
      "command": "cargo test -p rurix-render --lib visible_cluster_set",
      "exit_code": 0
    },
    {
      "seq": 2,
      "command": "cargo test -p rurix-render --lib geometry::visbuffer / shadow::vsm / rt::as_manager",
      "exit_code": 0
    },
    {
      "seq": 3,
      "command": "cargo run -q -p rurix-render --bin g9_g93_geometry_probe",
      "exit_code": 0
    },
    {
      "seq": 4,
      "command": "cargo build -p rurix-render --features vulkan --bin g9_m95_visbuffer_swhw",
      "exit_code": 0
    },
    {
      "seq": 5,
      "command": "g9_m95_visbuffer_swhw (RURIX_REQUIRE_REAL=1 + RURIX_VK_VALIDATION=1)",
      "exit_code": 0
    }
  ],
  "evidence_level": "measured_local",
  "run_url": "",
  "timestamp": "20260814T144459Z",
  "environment": {
    "os": "Windows-11-10.0.28120-SP0",
    "python_version": "3.12.1",
    "cargo_version": "cargo 1.93.1 (083ac5135 2025-12-15)",
    "rustc_version": "rustc 1.93.1 (01f6ddf75 2026-02-11)"
  },
  "notes": ""
}
